Grimes, SCREAM, Art Angels, 2020-08-08T10:30:00.000Z
Grimes, laughing and not being normal, Art Angels, 2020-08-08T10:35:00.000Z
Foo Fighters, These Days, Wasting Light, 2020-08-08T10:40:00.000Z
Foo Fighters, A Matter Of Time, Wasting Light, 2020-08-08T10:45:00.000Z
Foo Fighters, Back &amp; Forth, Wasting Light, 2020-08-08T10:50:00.000Z
Foo Fighters, Walk, Wasting Light, 2020-08-08T10:55:00.000Z
Coldplay, Oceans, Ghost Stories ( Deluxe Edition ), 2020-08-08T11:00:00.000Z
Coldplay, A Sky Full of Stars, Ghost Stories ( Deluxe Edition ), 2020-08-08T11:05:00.000Z
Coldplay, A Sky Full of Stars, Ghost Stories ( Deluxe Edition ), 2020-08-08T11:05:00.000Z
Coldplay, Ghost Story, Ghost Stories ( Deluxe Edition ), 2020-08-08T11:10:00.000Z
Coldplay, Another's Arms Remix ( Feat. Cans ), Ghost Stories ( Deluxe Edition ), 2020-08-08T11:15:00.000Z
Coldplay, Ink, Ghost Stories ( Deluxe Edition ), 2020-08-08T11:20:00.000Z
Coldplay, Ink, Ghost Stories ( Deluxe Edition ), 2020-08-08T11:20:00.000Z
Coldplay, O, Ghost Stories ( Deluxe Edition ), 2020-08-08T11:25:00.000Z
Coldplay, O, Ghost Stories ( Deluxe Edition ), 2020-08-08T11:25:00.000Z
Coldplay, O (Part 2 - Reprise), Ghost Stories ( Deluxe Edition ), 2020-08-08T11:30:00.000Z
Coldplay, True Love, Ghost Stories ( Deluxe Edition ), 2020-08-08T11:35:00.000Z
Coldplay, True Love, Ghost Stories ( Deluxe Edition ), 2020-08-08T11:35:00.000Z
Coldplay, All Your Friends, Ghost Stories ( Deluxe Edition ), 2020-08-08T11:40:00.000Z
Coldplay, Always In My Head, Ghost Stories ( Deluxe Edition ), 2020-08-08T11:45:00.000Z
Coldplay, Always In My Head, Ghost Stories ( Deluxe Edition ), 2020-08-08T11:45:00.000Z
Coldplay, Midnight, Ghost Stories ( Deluxe Edition ), 2020-08-08T11:50:00.000Z
Coldplay, Midnight, Ghost Stories ( Deluxe Edition ), 2020-08-08T11:50:00.000Z
Coldplay, Midnight (Jon Hopkins Remix), Ghost Stories ( Deluxe Edition ), 2020-08-08T11:55:00.000Z
Coldplay, Magic, Ghost Stories ( Deluxe Edition ), 2020-08-08T12:00:00.000Z
Coldplay, Magic, Ghost Stories ( Deluxe Edition ), 2020-08-08T12:00:00.000Z
CHVRCHES, Recover, The Bones Of What You Believe, 2020-08-08T12:05:00.000Z
CHVRCHES, Recover, The Bones Of What You Believe, 2020-08-08T12:05:00.000Z
CHVRCHES, By The Throat, The Bones Of What You Believe, 2020-08-08T12:10:00.000Z
CHVRCHES, Lungs, The Bones Of What You Believe, 2020-08-08T12:15:00.000Z
CHVRCHES, You Caught The Light, The Bones Of What You Believe, 2020-08-08T12:20:00.000Z
65daysofstatic, Another Code Against The Gone, The Fall Of Math, 2020-08-08T12:25:00.000Z
65daysofstatic, Retreat! Retreat!, The Fall Of Math, 2020-08-08T12:30:00.000Z
65daysofstatic, Install A Beak In The Heart That Clucks Time In Arabic, The Fall Of Math, 2020-08-08T12:35:00.000Z
Imagine Dragons, Demons, Night Visions, 2020-08-08T12:40:00.000Z
Imagine Dragons, Tiptoe, Night Visions, 2020-08-08T12:45:00.000Z
Imagine Dragons, Hear Me, Night Visions, 2020-08-08T12:50:00.000Z
Imagine Dragons, Every Night, Night Visions, 2020-08-08T12:55:00.000Z
Imagine Dragons, Bleeding Out, Night Visions, 2020-08-08T13:00:00.000Z
Imagine Dragons, Amsterdam, Night Visions, 2020-08-08T13:05:00.000Z
Imagine Dragons, Working Man, Night Visions, 2020-08-08T13:10:00.000Z
Imagine Dragons, Radioactive, Night Visions, 2020-08-08T13:15:00.000Z
Imagine Dragons, On Top Of The World, Night Visions, 2020-08-08T13:20:00.000Z
Imagine Dragons, Underdog, Night Visions, 2020-08-08T13:25:00.000Z
Imagine Dragons, Cha-Ching (Till We Grow Older), Night Visions, 2020-08-08T13:30:00.000Z
Imagine Dragons, It's Time, Night Visions, 2020-08-08T13:35:00.000Z
Imagine Dragons, Nothing Left To Say / Rocks, Night Visions, 2020-08-08T13:40:00.000Z